{
  "id": "image-edit-kontext-v0",
  "version": "0.3.0",
  "model_profile": "flux-dev-family",
  "required_inputs": [
    "prompt",
    "seed",
    "base_image",
    "reference_image",
    "mask_image",
    "control_image"
  ],
  "outputs": [
    "image"
  ],
  "schema_version": "0.1.0",
  "bindings": {
    "prompt": {
      "node_id": "9",
      "input_name": "text"
    },
    "seed": {
      "node_id": "13",
      "input_name": "seed"
    },
    "base_image": {
      "node_id": "6",
      "input_name": "image"
    },
    "reference_image": {
      "node_id": "7",
      "input_name": "image"
    },
    "mask_image": {
      "node_id": "17",
      "input_name": "image"
    },
    "control_image": {
      "node_id": "25",
      "input_name": "image"
    }
  },
  "graph": {
    "3": {
      "class_type": "UNETLoader",
      "inputs": {
        "unet_name": "flux1-dev-kontext_fp8_scaled.safetensors",
        "weight_dtype": "default"
      }
    },
    "4": {
      "class_type": "CLIPLoader",
      "inputs": {
        "clip_name": "t5xxl_fp8_e4m3fn_scaled.safetensors",
        "clip_name2": "clip_l.safetensors",
        "type": "flux2"
      }
    },
    "5": {
      "class_type": "VAELoader",
      "inputs": {
        "vae_name": "ae.safetensors"
      }
    },
    "6": {
      "class_type": "LoadImage",
      "inputs": {
        "image": ""
      }
    },
    "7": {
      "class_type": "LoadImage",
      "inputs": {
        "image": ""
      }
    },
    "16": {
      "class_type": "FluxKontextImageScale",
      "inputs": {
        "image": [
          "7",
          0
        ]
      }
    },
    "8": {
      "class_type": "VAEEncode",
      "inputs": {
        "pixels": [
          "16",
          0
        ],
        "vae": [
          "5",
          0
        ]
      }
    },
    "9": {
      "class_type": "CLIPTextEncode",
      "inputs": {
        "text": "",
        "clip": [
          "4",
          0
        ]
      }
    },
    "10": {
      "class_type": "CLIPTextEncode",
      "inputs": {
        "text": "",
        "clip": [
          "4",
          0
        ]
      }
    },
    "11": {
      "class_type": "FluxGuidance",
      "inputs": {
        "guidance": 2.5,
        "conditioning": [
          "9",
          0
        ]
      }
    },
    "12": {
      "class_type": "ReferenceLatent",
      "inputs": {
        "conditioning": [
          "11",
          0
        ],
        "latent": [
          "8",
          0
        ]
      }
    },
    "17": {
      "class_type": "LoadImage",
      "inputs": {
        "image": ""
      }
    },
    "18": {
      "class_type": "ImageToMask",
      "inputs": {
        "image": [
          "17",
          0
        ],
        "channel": "red"
      }
    },
    "20": {
      "class_type": "VAEEncodeForInpaint",
      "inputs": {
        "pixels": [
          "6",
          0
        ],
        "vae": [
          "5",
          0
        ],
        "mask": [
          "18",
          0
        ],
        "grow_mask_by": 0
      }
    },
    "21": {
      "class_type": "ConditioningSetMask",
      "inputs": {
        "conditioning": [
          "12",
          0
        ],
        "mask": [
          "18",
          0
        ],
        "strength": 1.0,
        "set_cond_area": "default"
      }
    },
    "22": {
      "class_type": "ConditioningSetMask",
      "inputs": {
        "conditioning": [
          "10",
          0
        ],
        "mask": [
          "18",
          0
        ],
        "strength": 1.0,
        "set_cond_area": "default"
      }
    },
    "24": {
      "class_type": "IPAdapterFluxLoader",
      "inputs": {
        "ipadapter": "ip-adapter.bin",
        "clip_vision": "google/siglip-so400m-patch14-384",
        "provider": "cuda"
      }
    },
    "25": {
      "class_type": "LoadImage",
      "inputs": {
        "image": ""
      }
    },
    "27": {
      "class_type": "ApplyIPAdapterFlux",
      "inputs": {
        "model": [
          "3",
          0
        ],
        "ipadapter_flux": [
          "24",
          0
        ],
        "image": [
          "25",
          0
        ],
        "weight": 0.85,
        "start_percent": 0.0,
        "end_percent": 1.0
      }
    },
    "13": {
      "class_type": "KSampler",
      "inputs": {
        "seed": 0,
        "steps": 20,
        "cfg": 1.0,
        "sampler_name": "euler",
        "scheduler": "simple",
        "denoise": 1.0,
        "model": [
          "27",
          0
        ],
        "positive": [
          "21",
          0
        ],
        "negative": [
          "22",
          0
        ],
        "latent_image": [
          "20",
          0
        ]
      }
    },
    "14": {
      "class_type": "VAEDecode",
      "inputs": {
        "samples": [
          "13",
          0
        ],
        "vae": [
          "5",
          0
        ]
      }
    },
    "15": {
      "class_type": "SaveImage",
      "inputs": {
        "filename_prefix": "stroy-edit",
        "images": [
          "14",
          0
        ]
      }
    }
  },
  "notes": "Mask-constrained Kontext replacement with IP-Adapter identity conditioning (v0.3.0). The BASE image (current room state) feeds VAEEncodeForInpaint whose noise mask confines sampling to the affected region - unmasked pixels keep the base exactly. The REFERENCE stays conditioning-only (ReferenceLatent path, node 12 retained as a locality hint) so a whole-room reference can no longer collapse the output onto itself; identity transfer is carried by the Shakker-Labs comfyui-ipadapter-flux nodes: node 25 loads the CROPPED reference (control_image role, same asset as reference_image), node 24 IPAdapterFluxLoader loads ip-adapter.bin plus the google/siglip-so400m-patch14-384 CLIP-Vision encoder (provider cuda) and outputs IP_ADAPTER_FLUX_INSTANTX, and node 27 ApplyIPAdapterFlux patches the UNET (model from node 3) with that adapter and the cropped reference image before KSampler 13; node 27's weight input is driven by ipa_weight at execution time. The mask PNG (white=edit region, linear feather ramp baked in server-side) binds through ImageToMask(red). Node inputs verified against the box fork object_info (v9.1): ImageToMask(image,channel), VAEEncodeForInpaint(pixels,vae,mask,grow_mask_by 0..64), ConditioningSetMask(conditioning,mask,strength,set_cond_area); FeatherMask node deliberately not used (no single feather input - feathering is baked into the mask PNG server-side)."
}
