{
  "schema_version": "0.1.0",
  "id": "flux-redesign-v0",
  "version": "0.2.0",
  "model_profile": "flux-dev-family",
  "required_inputs": [
    "prompt",
    "seed"
  ],
  "outputs": [
    "image"
  ],
  "bindings": {
    "prompt": {
      "node_id": "2",
      "input_name": "text"
    },
    "seed": {
      "node_id": "6",
      "input_name": "seed"
    }
  },
  "graph": {
    "1": {
      "class_type": "CheckpointLoaderSimple",
      "inputs": {
        "ckpt_name": "flux1-dev-fp8.safetensors"
      }
    },
    "2": {
      "class_type": "CLIPTextEncode",
      "inputs": {
        "text": "",
        "clip": [
          "1",
          1
        ]
      }
    },
    "3": {
      "class_type": "CLIPTextEncode",
      "inputs": {
        "text": "",
        "clip": [
          "1",
          1
        ]
      }
    },
    "4": {
      "class_type": "FluxGuidance",
      "inputs": {
        "conditioning": [
          "2",
          0
        ],
        "guidance": 3.5
      }
    },
    "5": {
      "class_type": "EmptySD3LatentImage",
      "inputs": {
        "width": 1024,
        "height": 1024,
        "batch_size": 1
      }
    },
    "6": {
      "class_type": "KSampler",
      "inputs": {
        "seed": 0,
        "steps": 20,
        "cfg": 1.0,
        "sampler_name": "euler",
        "scheduler": "simple",
        "denoise": 1.0,
        "model": [
          "1",
          0
        ],
        "positive": [
          "4",
          0
        ],
        "negative": [
          "3",
          0
        ],
        "latent_image": [
          "5",
          0
        ]
      }
    },
    "7": {
      "class_type": "VAEDecode",
      "inputs": {
        "samples": [
          "6",
          0
        ],
        "vae": [
          "1",
          2
        ]
      }
    },
    "8": {
      "class_type": "SaveImage",
      "inputs": {
        "filename_prefix": "stroy",
        "images": [
          "7",
          0
        ]
      }
    }
  },
  "notes": "Full flux1-dev-fp8 ComfyUI API-format graph."
}
